post_date,medication_mentioned,post_title,post_text,subreddit,upvotes,comments_count
2025-09-29 16:39:32.021025,Ozempic,Started Ozempic last week - questions,Started Ozempic 0.25mg last week. Feeling nauseous especially in the morning. Is this normal?,diabetes,15,8
2025-09-22 16:39:32.021059,Ozempic,Ozempic side effects?,Anyone else getting headaches with Ozempic? About 2-3 hours after injection.,diabetes,23,12
2025-09-15 16:39:32.021064,Ozempic,Ozempic success story,"Been on Ozempic for 3 months. Down 25 lbs, no side effects. Very happy!",WeightLossAdvice,156,34
2025-09-08 16:39:32.021068,Ozempic,Dizziness with Ozempic,Experiencing some dizziness when standing up quickly. Doctor says it is blood sugar related.,diabetes,8,5
2025-09-01 16:39:32.021072,Ozempic,Ozempic vs Wegovy,Comparing Ozempic and Wegovy. Both work well but Ozempic seems gentler on stomach.,medical,42,19
