id,subreddit,title,selftext,score,num_comments,created_utc,permalink
1mhpc8z,forhire,"Rules Reminder + Updates: Low Quality, Commission &amp; Other Things","I was hoping to not have to make another announcement until we got more mods, but this unfortunately is getting pushed before that.  From this point on, any of these job postings will result in an immediate permaban. All but a few of these are already rule violations, but have been removed in a lesser degree with a ""second chance"". We're not entertaining these any longer, due to repeat offenders and the quality of the jobs. All but a handful of these are predatory, opportunistic scammers and have no place here.  \-  **Commission-Based Only Jobs:** We've had it up to here with this, along with the arguments of how ""they're earning more than $20/hr, give us a break!"" The rule is a blanket for all the crappy ones that may not be esteemed as yours. If you're not paying them a $15/hr salary along with the commission, it's not welcome here.  **Paid Posters + Accounts:** This is something we've already been banning for a short bit, but take this as the ""This isn't welcome here"" hint. Renting an account or asking for someone to use theirs to post for you counts as account buying/renting. Most of these are against TOS of the providers that allow you to use them in the first place.  **Vague, Low Quality Posts:** ""DM me for a quick $30 job"", or ""Need help with something, message me"" are not longer permitted. If you can't state what the job is so that a freelancer can understand if they're good for the job, that's on you. If you're doing it so you don't get banned or removed, that's no longer allowed.  **Intentional Hiring from India or the Philippines for Low Pay:** Otherwise known as ""South Asians highly encouraged to apply"" in code speak. I warned about this before last year, but now it is a bannable on-sight offense. This is still going on, and under the guise of ""sir pls, it's a decent pay rate for &lt;region of India&gt;!"" Or on top of that, some wannabe guru from the US/Canada looking to outsource his non-college stuff to a Filipino assistant for $4/hr, and ""mating"" us when we point out it's a rule-break.  We've already had the discussion of why these pay rates aren't allowed on this subreddit. We heavily encourage and point you to r/slavelabour if that's what you want.   **Causing Others to Violate the ""No PM"" Rule:** This is something we've always enforced since 2019 automatically. This is enforced with a permaban as well. That said, if your post is encouraging users to apply in the comments instead of sending you a message, you'll be getting a ban as well for making them break the rule. Read the room instead of mass-spamming your job across a dozen subreddits.  This includes codewords, asking for contact info or portfolio links in the comments.  **Promising a Job, but it's Guised Promotion to a Job Board:** We've seen this a dime a dozen lately; someone promising a graphic design job, but then pointing to a new startup job board/work platform. This is no longer allowed. Most of these are a Reddit account affiliated with the ""brand"" of the board in question.  **No OF Content:** That's right, we heard you! We've had it up to here with it now, and things like ""OF chatters"", ""OF girls"" or ""OF agencies"" are no longer allowed on this subreddit.  These have always been removed to a point, but it's gotten to the point that OF girls think that promoting their account is ""freelance work"" and ""professional"". That's not even mentioning how abusive and low-paying OF agencies are, or how discriminatory a lot of the job postings come across.   Note that legitimate jobs that require some NSFW things (novel writing, artwork, etc) are not affected by this. It's not our intention to stomp on legitimate expression or issues.   **Hiring Based on Gender, Age and Race:** This may fly in your third world country, but we absolutely will not stand for this. Unless it's a legitimate need such as a modeling gig or you need a voice for a game, you're not allowed to blatantly say ""Need female appointment setters"" or ""Hungry teens for sales jobs"".  On that note, you're prohibited from hiring minors on this subreddit, due to liability reasons. There's people who think hiring 13-year-olds for 40+ hours a week is okay.  \-  Read the room. Read the rules. Please.   And for all things sane, if your post gets removed or you get banned, ***read your removal message.*** We clearly tell you why you're banned or it got removed. Stop messaging us ""Omg why did I get banned?"" when you're told.  Obligatory announcement over. Happy freelancing.",23,14,1754340589,https://www.reddit.com/r/forhire/comments/1mhpc8z/rules_reminder_updates_low_quality_commission/
1luy872,forhire,[META] Summer 2025 - Hiring New Mods!,"Hello r/forhire community!  From repeated feedback and comments, we're aware of the moderation issues this subreddit is having. Primarily, towards low-quality, low-paying jobs that often have scammers behind them. We've heard you, and I personally have not wanted to step toes to try to resolve some of these issues. After a year and some of me being here, I have no choice but to try to solve these issues on my own.  Due to some different issues taking place the past few months, me and another mod have mutually agreed to expand the mod team to set things back on track. We need a roster to help get things back on track, and that's the first step going forward to fix the quality of the posts.  \-  *NOTE: This is an unpaid, volunteer position. Reddit community moderators are not paid any money.*  We're looking for approximately 7 mods starting out with the following qualities:  **Account Age/Karma:** We're looking for people who've been on Reddit for awhile. Minimum requirements are an account age of two years, with at least 2,000 combined (post+comment) karma. You're automatically disqualified if your account doesn't meet these requirements.  **18+:** You must be 18 or older. We do not allow minors on the mod staff.  **PC/Desktop access:** While Reddit allows mobile modding, we would like prospective moderators to have a full computer screen and a keyboard to work with. Mac or PC is fine, just something beyond tablet and smartphone access.  **Previous Modding Experience:** We're open to new faces, but those with previous Reddit modding experience are preferred. We will accept an unexperienced face over someone who may be part of a Reddit Mod cabal for community cohesion.  **Professional Freelancer:** It goes to say that ""Command should do every job once."" This is a community of freelancers, and would like someone who understands life ""in the trenches"" to be the one helping the community. You get being paid fairly, struggles of applying for a contract, why it isn't reasonable to design a logo in 5 minutes for $3. Those sorts of things.  **Respect the Rules:** We need someone who respects r/forhire's rules, and have no qualm enforcing them. If you don't want to hand out bans for bannable offenses, or are hoping to weasel in and change rules such as the required pay rate or commission-based pay, press Go and continue on.   **Past Track Record:** You must not have been banned for an offense on this subreddit. We will not consider warnings, If you have a positive community influence we'll consider you. Suffice to say a permabanned scammer on the USL will not be allowed to join.  **Self-Interests:** This isn't a place to get a power-trip, push agendas/gripes, be a bully or act like a nincompoop. Be courteous, be firm if someone's pulling nonsense. We don't want people who end up on r/BadMods and the front page for senseless, petty-driven nonsense. This includes things like intentionally removing posts for profit, acting out against users unfairly and using the subreddit to promote your own means, views and abusing your position.  **Varied Time Zones:** We're looking for a wide spread of users to help us internationally. Currently our most active mods are from the EST (Eastern Time Zone), and we're looking to expand outside of that. Our end goal is to have an all-hour overview.  **Fluent English:** The head mod team speaks English, and everyone else who is on the current roster speaks English. This isn't the position for you if you need to put things into Google Translate. Please properly type English, no mobile/text speak with zero punctuation and capital letters.  **Professionalism and Courtesy:** f you have customer service experience, you get what this means. We ask for that friendly extra mile here, as we know how it's a turn off to get smacked in face from mod teams such the bigger subreddits.  **Time Commitment:** We all have lives outside of Reddit and the screen, we completely get that. Right now we're looking at concentrated efforts of maybe an hour a day until the mod queue is caught up. Once we get everything going smoothly, you'll probably spend less time than that. We will adjust the mod team accordingly to reach this balance, so that people aren't burning themselves out.   \-  # How to Apply?  Simply drop a message to us in ModMail outlining your experience. Tell us about why you want to be a mod, your availability and how you fit in with the requirements. To make sure you read these, tell us about a memorable experience you had while gaming, or with some other hobby if video games aren't your thing.  We'll reach out to you with further questions if you're a good fit, and onboard you with a probationary period once you pass additional questioning.   May the odds be forever in your favor!",11,0,1752003782,https://www.reddit.com/r/forhire/comments/1luy872/meta_summer_2025_hiring_new_mods/
1n8zf8l,forhire,"[HIRING] - ROUND TWO - Web developers - NextJS, React, Postgres/Supabase, Laravel, AI Integrations","**My previous post got a large number of applicants, however 80% of the applicants did not provide the basic information I requested. A further 60% had irrelevant work experience or a portfolio composed purely of personal learning projects. No shade, I know how tough it can be to get started in the industry. At this moment I'm looking for people with genuine work experience in relevant projects using similar tech. Please do not apply if this does not describe you.**      I'm a freelancer myself, and I've got too big of a workload to handle. I'm transitioning into building an agency and would like to bring on a couple of developers to take on subcontracted work.  All client work I do at the moment uses React on the frontend, and then most frequently NextJS as the framework, although a decent number use Laravel. Database/auth is more often than not Supabase or self-hosted Postgres.  Majority of the work consists of building out SaaS MVPs, frequently built entirely around or heavily featuring AI integrations.  Unfortunately, a lot of the work consists of clients coming to me with something that was vibe-coded, and I either need to clean it up best I can to get it ready to go live or pitch them on a rewrite, but do be forewarned that vibe coded messy projects are the norm.  A number of client projects come to us directly from Replit, Lovable, v0, etc.  I am okay with you using AI, I use it all day long myself, but you must understand how to use it to deliver code that makes sense and isn't over-engineered, or full of security and performance issues.  Freelancers must be fluent in English and have delivered real projects for paying clients, using the technologies above. I am okay with only being familiar with one of the two frameworks, NextJS or Laravel.  Depending on your qualifications the rate will range from $20-$60/hr.  If interested please DM me your hourly rate, portfolio/github, your geographical location, and your availability in terms of consistent hours/week and start date -- **applicants who do not provide all of this information will not be considered, sorry**. If you have an existing Upwork account (or similar) please include it as well.  Those who are shortlisted I'll ask to hop on a quick 15 min zoom call with me to talk through the work and your experience.  I'll be looking to bring people on within the next month.  **PLEASE DO NOT USE AI TO WRITE YOUR MESSAGES TO ME. Sorry, I just can't stand longwinded fluffed up AI writing.**",2,4,1757059973,https://www.reddit.com/r/forhire/comments/1n8zf8l/hiring_round_two_web_developers_nextjs_react/
1n8o7eq,forhire,[Hiring] social media manager,"Hello! I have some social media management clients in my new business. I’m looking for someone to help me create graphics and reels, since I also run other businesses and don’t have enough time to handle all the clients myself. Please send me your portfolios and rates — I’ll especially consider lower rates as I’m just getting started with this :) Thanks!  Proposals without a portfolio will not be accepted — $15/h",9,14,1757024857,https://www.reddit.com/r/forhire/comments/1n8o7eq/hiring_social_media_manager/
1n90lbn,forhire,[For Hire] MS Access • VBA • Excel • Reporting • SQL – $35/hr,"**Need a Microsoft Access / VBA / Excel database expert who delivers more than promised?**  Hi, I’m Kostas, a database developer with **25+ years of experience** building **fast, stable, user-friendly business systems**.  🌐 **Portfolio &amp; Links**   Website: [https://mexdb.com](https://mexdb.com/)   Portfolio: [https://kostasportfolio.carrd.co/](https://kostasportfolio.carrd.co/)   LinkedIn: [https://www.linkedin.com/in/kostas-mexias/](https://www.linkedin.com/in/kostas-mexias/)   YouTube: [https://www.youtube.com/@kostasmex](https://www.youtube.com/@kostasmex)  **I can help you:**  * Build or improve Microsoft Access, Excel, VBA systems, Power Apps, Power Query * Automate quotes, orders, inventory, invoices, reporting * Create polished dashboards in Power BI, Excel, MS Access, Tableau * Optimize for remote &amp; multi-user access * Reduce repetitive work, input errors, and costs  **Why hire me:**  * Fast responses &amp; on-time delivery * Thoroughly tested, business-focused solutions * Large reusable code library = faster, cheaper, fewer bugs  **Client feedback:**  * “Most skillful freelancer I’ve worked with in the database space.” – *Paul Cracknel* * “Amazing job on a complex project. Delivered on time &amp; budget.” – *Alan Jenkins*  💬 **Available now** – Message me here or schedule a Zoom call.",1,1,1757064542,https://www.reddit.com/r/forhire/comments/1n90lbn/for_hire_ms_access_vba_excel_reporting_sql_35hr/
1n8zrk7,forhire,[HIRING] URGENT Appointment setter - UK/USA Based (commission base or close appointment pay),"Hey everyone,  I require a UK based appointments setter to call from a list of UK businesses to arrange appointments for us to see them. We are a marketing agency running ads for roofing/ landscaping clients in the UK and USA  Please get in touch if you are interested in this position. We pay £100-250 per appointment and you can work the hours you choose. DM for more details. Thank you for reading  Highly skilled people needed, URGENT, DM",1,1,1757061339,https://www.reddit.com/r/forhire/comments/1n8zrk7/hiring_urgent_appointment_setter_ukusa_based/
1n8z9ki,forhire,"[For Hire] Fullstack Development for $2,500 – MVP Delivered in 30 Days","Hey everyone!  I’m a fullstack developer offering discounted MVP / web app builds for just $2,500. If you’ve got a startup idea, side hustle, or just want to try something fast — this offer is for you!  ## What You’ll Get: 	•	Custom Fullstack Web App or MVP (React, Node, Express, MongoDB) 	•	Modern, Clean UI/UX Design (no cookie-cutter templates — actual tailored design) 	•	1 Month of Free Post-Launch Support (bug fixes, tweaks, etc.) 	•	Delivered in 30 Days  Whether it’s a SaaS tool, marketplace, dashboard, CRM, booking app — I’ll help you bring it to life without breaking the bank.  ## Examples of what I can build: 	•	SaaS dashboards 	•	Booking/reservation systems 	•	Admin panels 	•	Lead management tools 	•	Simple marketplaces 	•	AI-integrated tools (OpenAI, Twilio, etc.)  ## DM Me If: 	•	You have an idea and need help scoping it 	•	You want to see samples of past work 	•	You’re ready to get started    DM me or leave a comment and I’ll get back to you quickly. Happy to share past work (https://docs.google.com/document/d/1kYFuFdbngd9AuHqVJXZVHWDqe905VHZSb2QaYAO73Ao/edit?usp=sharing) or jump on a quick call to discuss your MVP.  Let’s build something awesome!",1,1,1757059317,https://www.reddit.com/r/forhire/comments/1n8z9ki/for_hire_fullstack_development_for_2500_mvp/
1n8z107,forhire,[For Hire] Tech Sales/Lead Generator Expert,"$15/hr - My process is simple straight forward  1. Define the target profile (industry, company size and budget indicators). 2. Research their website, LinkedIn or any available social channels to gather information about the company and the decision makers. 3. Collect necessary information that would enable me to contact them and populate it on a Google Sheet. 4. Qualify these leads by checking their website, social media presence, and search visibility. If a company isn't showing up on Google, doesn't run ads, or posts irregularly on LinkedIn, those are clear signs of marketing gaps. 5. Update the Google sheet with companies that fit the criteria, and email the ceo with the information I have found, and proceed to establish contact on his instruction. All outreaches would be tracked on your CRM of choice.  To nurture the leads:  1. I would research deeper to know in particular the marketing gaps I can find out, including website performance, social media presence and local seo. 2. With what I have found out, I would create an email sequence for three weeks (3 times per week). Then start with a personalized outreach, followed by the sequence of emails. 3. I will also include cold calling. Once they show interest, I brief the ceo with all details (pain points, signals of budget, and engagement history) so they can step into the call fully informed.  Send me a DM if you will be needing my service.",1,1,1757058377,https://www.reddit.com/r/forhire/comments/1n8z107/for_hire_tech_saleslead_generator_expert/
1n8wumq,forhire,[HIRING] Data Entry Assistants Part-Time or Full-Time – Flexible Hours | $20–$25/hours,"Hi all! I’m looking to hire reliable remote workers for flexible part-time or full-time roles.  * **Hours:** 8–40 per week (flexible, your choice) * **Tasks:** Data entry, content moderation, basic virtual assistant duties * **Requirements:** Strong attention to detail and good communication  * Location US and Canada  If interested, please message me on Reddit with your location.",0,10,1757050139,https://www.reddit.com/r/forhire/comments/1n8wumq/hiring_data_entry_assistants_parttime_or_fulltime/
1n8we5o,forhire,[For Hire] AI Agent Developer - Custom Intelligent Automation Solutions,"Experienced AI developer offering custom AI agent development services. I specialize in building intelligent agents that can automate workflows, handle customer interactions, manage data, and integrate with your existing systems.  What I Build:  Customer service agents that understand your business Research and data analysis automation Workflow management and task automation Multi-agent systems for complex business processes Web-integrated agents with real-time capabilities  Service Tiers:  ## Basic Agent - $150  - Single-purpose agent (customer FAQ, simple automation) - Choice of AI provider (OpenAI, Anthropic, Google Gemini, OpenRouter) - Basic web integration and setup - Standard knowledge base integration - MCP server support for tool connections  ## Advanced Agent - $350  - Multi-functional agent with complex logic - Flexible AI provider configuration - Custom knowledge base and workflow automation - Plugin integrations for extended functionality - Advanced MCP integrations and custom tool development  ## Enterprise System - $750+  - Multi-agent orchestration - Custom plugin development and integrations - Advanced APIs, databases, and third-party connections - Scalable architecture with ongoing optimization - Custom MCP servers to integrate with your existing software stack - Technical Advantages:  Provider Flexibility: Choose from OpenAI, Anthropic, Google Gemini, OpenRouter out-of-the-box  MCP Protocol: Native support for Model Context Protocol tool connections  Plugin Architecture: Easy expansion with additional capabilities  Self-Hosted: Complete data privacy and control  BYOK: Use your own API keys for cost control  Hosting starts at $10/month for basic setups, scaling with memory/compute needs.  Portfolio available upon request. Let's discuss your specific automation needs!",1,1,1757048524,https://www.reddit.com/r/forhire/comments/1n8we5o/for_hire_ai_agent_developer_custom_intelligent/
1n8rozt,forhire,[Hiring] TikTok Scraping &amp; Editing Tool,"Completed by September 30, 2025 (flexible, let’s discuss)  I currently have a lot of it built but need someone to completely start over.  I’m looking for a skilled full-stack developer to build a tool that scrapes TikTok videos, edits them, and automates uploads to Google Drive with some smart features. I’ve got a detailed spec ready, and I’m offering $2,000 via escrow once it’s done and bug-free. Here’s the breakdown:  What It Does  	•	Download/Store Videos: Scrape TikTok videos (by account, URL, or search) using Tikwm.com, store them in Supabase with metadata (URL, date, likes), and avoid duplicates. Options to download whole profiles or by url. 	•	Editing Features: Transcribe audio, add styled subtitles (ASS) with FFMPEG, output as MP4, PNG thumbnails, or GIF previews. 	•	Bulk Caption Management: Copy captions, bulk edit (remove keywords like #fyp, add custom hashtags), show edited titles. Options to strip or append text. 	•	Google Drive Integration: Auto-upload edited videos to Google Drive on a schedule (e.g., daily at 2 AM) using the API. 	•	Uploads: Handle upload ordering and logic. Includes “Niche Content Rotation”—set rules per account (e.g., most liked, recent) and cycle uploads evenly across accounts. Options to order by likes, date, or manual reorder. 	•	Commenting System: Copy top comments from original posts, build a master list of top 100 comments (not tied to posting, just for reference). 	•	Website/UI: Simple interface with bot management (create/edit/delete), stats, on/off switches, and a TikTok-style content view (infinite scroll, hover play). Mobile/desktop friendly. 	•	Error Handling: Basic error detection (network/API issues) with email/in-app notifications.  Tech Stack  	•	Vercel (hosting/scalability) 	•	Supabase (video metadata storage) 	•	FFMPEG (video editing) 	•	Nuxt.js (UI/frontend) 	•	Google Drive Service Account API (uploads) 	•	Tikwm.com (TikTok scraping)  Requirements  	•	Experience with full-stack dev (frontend + backend). 	•	Familiarity with video processing (FFMPEG) and APIs (RapidAPI, Google Drive). 	•	Ability to build a clean, scalable UI with Nuxt.js and deploy on Vercel. 	•	Bonus if you’ve worked with scraping or automation tools before.  Payment &amp; Process  	•	$2,000 total, released via escrow when the tool’s complete and bug-free. 	•	I’ve got a full Notion spec (details above) I’ll share with serious applicants—covers everything from downloading to UI. 	•	Happy to chat milestones or progress updates as we go.  How to Apply  DM me with:  	•	A quick intro and your experience with the tech stack. 	•	Links to related past projects (GitHub, portfolio, etc.) if you’ve got ‘em. 	•	Your estimated timeline for this.  Excited to find someone awesome for this! Questions? Drop them in the comments or DM me.",2,3,1757034231,https://www.reddit.com/r/forhire/comments/1n8rozt/hiring_tiktok_scraping_editing_tool/
1n8zo8i,forhire,"We're [HIRING] Flexible hours (3–4 hours/day or more), with training provided. Pay: $35 USA/hour.","We’re currently hiring for remote roles involving basic administrative support, data entry, and task coordination.   Details:  Remote (Worldwide — priority for USA &amp; Canada)  Flexible schedule  Roles: Administrative tasks, data entry, task coordination  Training provided  Must be 20+ years old  Pay: $35 USD/hour    If you're interested, send me a message on Reddit with your location.",0,2,1757060961,https://www.reddit.com/r/forhire/comments/1n8zo8i/were_hiring_flexible_hours_34_hoursday_or_more/
