id,subreddit,title,selftext,score,num_comments,created_utc,permalink
1n7qbxh,forhire,[Hiring] UGC Creators Wanted – Females 18+  $20-60 an hour,"Are you 18 or older and passionate about content creation? We’re looking for **female UGC (User-Generated Content) creators** to join our growing social media marketing team. If you love making engaging short-form videos and know how to capture attention in the first 3 seconds, we want to hear from you.  # What You’ll Do:  * Create and edit short-form content for TikTok, Instagram Reels, and YouTube Shorts * Clip engaging moments from podcasts, YouTube videos, or raw footage * Add captions, sound effects, transitions, and text overlays to maximize watch time * Stay on top of social media trends to keep content fresh and relatable  # We’re Looking For:  * Females 18+ excited about UGC content creation * Strong editing skills (CapCut, Premiere Pro, Final Cut, or similar) * Understanding of social media hooks and algorithms * Ability to work quickly and independently * A creative eye for storytelling, pacing, and music  # Bonus Points If:  * You’ve grown social accounts before * You’re comfortable pitching creative content ideas * You’ve worked in fast-paced editing or creator environments  # 💰 Compensation:  Paid per project or on a retainer basis — flexible depending on experience.",1,2,1756932047,https://www.reddit.com/r/forhire/comments/1n7qbxh/hiring_ugc_creators_wanted_females_18_2060_an_hour/
1n7p3ew,forhire,[FOR HIRE] The Only Google Ads Guy You Need,"Hi Reddit, I’m Marco. For over 8 years, I’ve worked with brands managing ad budgets up to $500K/month, generating consistent profits of $90K+ weekly for my clients across 17 different industries. Many of my best clients started right here... on **Reddit!**  I've brought value to big brands, small businesses, and agencies alike. And now? ***You***.  **Before you continue reading...**   I don’t do contracts, and I offer a performance guarantee, so there’s zero risk to you. No bullsh\*t. Pricing starts at $1,500/month – $5,000 and here's **what** you get in return.  **1.** No setup fees &amp; a [Verified Google Partner](https://www.google.com/partners/agency?id=1522038016) with proven results.  **2.** A performance guarantee: measurable improvements in the first 30 days.  **3.** On-demand Reporting  **4.** Full-service Google Ads and CRO management.  **5.** Full-service Google Analytics 4, Tag Manager and Heatmapping \[upon request\]  **6.** Free-of-charge migration onto other PPC Platforms (such as Meta Ads, Amazon Ads, etc.)  **7.** White Label Friendly — Your clients, your branding, my work.  Spots are **limited** as I like to work closely with my clients and deliver **Ads that Convert.**  Ready to make Q4 yours? Message me on Reddit or check out my [Website and Testimonials here.](https://www.ppcsauce.com/)  I'm looking forward to hear from you!  All the best,  Marco 😉",1,1,1756929251,https://www.reddit.com/r/forhire/comments/1n7p3ew/for_hire_the_only_google_ads_guy_you_need/
1n7o9hr,forhire,"[For Hire] Need Leads? I Deliver Fast, Accurate US Business Leads You Can Use Today","Hi there,  I provide verified business leads in the US, mainly California, Texas, and Florida, though I can cover other states too. Each lead comes with as much information as I can find: business name, email, phone number, website, owner or CEO name, social media links, and the address.  I charge $0.70/lead for regular orders, and if you need a larger batch, we can negotiate a discount. I focus on delivering fast, accurate, and reliable leads that you can use straight away.  If you’re interested or want to discuss bulk orders, just send me a message and we’ll get it sorted.",1,1,1756927359,https://www.reddit.com/r/forhire/comments/1n7o9hr/for_hire_need_leads_i_deliver_fast_accurate_us/
1n7naxv,forhire,[HIRING] Looking for affiliates to promote a student-focused ebook (30–40% commission),"Hey everyone,  I’ve created an ebook designed specifically for students, and it’s been getting really good feedback. I’m looking for affiliates who’d be interested in promoting it.  🔹 Commission: 30–40% per sale 🔹 Audience: Students / education niche 🔹 Simple setup and ongoing support provided  If this sounds interesting, feel free to DM me for details!",0,4,1756925223,https://www.reddit.com/r/forhire/comments/1n7naxv/hiring_looking_for_affiliates_to_promote_a/
1n7lp59,forhire,[FOR HIRE] Full Stack Web Developer. Typescript | Vue.js | React.js | Nuxt.js | Next.js | Node.js | CI/CD | DevOps. $35/hr.,"Hey! My name is Alejandro and I'm a Full Stack Web Developer on the EST time zone. I have six years of experience as a Full Stack Developer working in the most diverse web app projects using all kinds of technologies, with more than fifteen enterprise projects delivered to date. My stack of choice is usually Typescript for front and back ends, with React/Next or Vue/Nuxt for the front-end, Node.js + Nest for the backend, any kind of database, containers and CI/CD pipelines. I'm currently working as a Software Engineer for a Fortune 500 company and am looking for a side project with an availability of 20 hours per week.  Check out [my resume](https://drive.google.com/file/d/1diFPUzcmegKH5ykEg4wRlAaS_TmZ4BVb/view?usp=sharing) , or contact me at [ale.nieto97@gmail.com](mailto:ale.nieto97@gmail.com)  My current rate is $35/hr.  Feel free to contact me to discuss any project or position free of charge :).",1,1,1756921649,https://www.reddit.com/r/forhire/comments/1n7lp59/for_hire_full_stack_web_developer_typescript/
1n7lg55,forhire,"[For Hire] Executive/Marketing Virtual Assistant | Funnels, Outreach &amp; Campaigns | Remote, Global","I’m Mariano, an Executive &amp; Marketing Virtual Assistant based in Barcelona with a strong background in helping entrepreneurs, agencies, and small businesses grow through structured outreach, tailored content, and systemized marketing operations. I'm fully bilingual (English &amp; Spanish, with a bit of a British accent) and combine the mindset of a marketer with the hands-on execution of a VA. If you’re looking for someone who can take initiative, bring structure to your marketing AND handle both strategy and details, I’d be glad to discuss your project.  **What I bring to the table:**  * **Marketing Campaigns &amp; Strategy:** I’ve built and launched multi-channel campaigns (email, social, paid ads) that generated consistent inbound leads and sales. From idea to copywriting to implementation, I know how to move people through a funnel. * **No-Code Websites &amp; Automation:** Experienced with Softr, Carrd, Airtable, BrilliantDirectories, and Zapier. I’ve built entire websites and client portals without code, integrating CRMs, payment systems, and automated onboarding flows. * **Outreach &amp; Lead Generation:** Managed LinkedIn Sales Navigator prospecting, cold email campaigns, and follow-up cadences. I combine research and personalization to increase conversion rates. * **Content Creation &amp; Repurposing:** Designed and scheduled content strategies across Instagram, LinkedIn, TikTok, and YouTube Shorts. I’ve worked with long-form video and transformed it into short, engaging, platform-ready content. * **Executive &amp; Admin Support:** Inbox and CRM management, scheduling, task tracking, research, and reporting. My role is often to be the operational backbone so founders can focus on growth.  **Past work includes:**  * Leading marketing operations for an LLC in the U.S., managing ad campaigns, customer acquisition funnels, and CRM integrations across multiple channels to make it grow from 10 to more than 650 monthly clients. * Supporting an American real estate broker by creating social media campaigns, digital products, funnels, and targeted email sequences that attracted new clients. * Building interactive learning materials and no-code websites for an online education company with hundreds of active students.  **Rates &amp; Availability:**  * $15–$18 per hour, depending on project scope. * Available for 10–25 hours per week or project-based work. * I own an LLC to make payments easier. * Can adapt to any timezone in the USA and Europe.  If you need someone who can execute, organize, and think strategically about your marketing and operations, comment here or send me a direct message.",1,1,1756921092,https://www.reddit.com/r/forhire/comments/1n7lg55/for_hire_executivemarketing_virtual_assistant/
1n7ldhi,forhire,"[For Hire] AI Engineer: LLM-Powered Apps, Tools, and Automations","I'm Tim, an AI engineer who builds assistants, automations, and data tools to remove busywork and reduce errors. If you have scattered docs, repetitive steps, or brittle scripts, I can turn them into reliable, LLM-powered systems your team can use daily. Some practical projects I can deliver:  - **Assistants with Built-in RAG:** Personalized, web-based assistants with knowledge grounded in sourced and verified docs and other data sources - **Automated Content Pipelines:** Turn briefs, notes, or data into consistent, on-brand articles, emails, and social posts - **Precedent-Based Evaluations:** Compare a submission to trusted past examples and show where it’s strong or weak, with reference links - **Proposal Automation:** Turn a few notes into a clear, professional proposal that stays on-message - **Reliable Research Workspace:** Ask a question and get answers that point to the exact paragraph in the source, ready to export - **Team Update Digest:** Turn chats and docs into short, role-specific briefings with links to the full context - **Multiple-Approach Problem Solver:** Explore several ways to solve a problem side by side, keeping the evidence for each - **Document Cleaner and Importer:** Turn messy files into clean, consistent records you can trust - **Fact-Check Assistant:** Verify claims against source material and show the minimum proof needed - **Interactive Content Reader:** Load books and manuals so you can ask questions, get grounded answers, and reuse a clean index across projects  Why work with me? I'm an independent freelancer that delivers agency-class work, without the overhead:  - **End-to-end ownership:** Front end, back end, and the connective tissue—shipped by a single craftsman who documents as he goes - **Flexible engagement:** Tight discovery, scoped milestones, and measurable outcomes that respect your domain constraints - **Thorough delivery:** Clean repo, evaluation hooks, and plain-English docs, ready for your team to operate and extend  Project-based pricing starts at $500 for a personalized, RAG-ready assistant or automation pipeline. Drop me a DM to book a free 30-minute call—we’ll define the scope and I'll get you a proposal that solves your problems within 24 hours. Also open to longer-term contracts and engagements. Em dashes are my own.",1,1,1756920929,https://www.reddit.com/r/forhire/comments/1n7ldhi/for_hire_ai_engineer_llmpowered_apps_tools_and/
1n7cs9q,forhire,"[For Hire] Experienced and Versatile Graphic Designer | Logo Design and Branding, Stream Graphics, Marketing Materials, Web Design and more","**PORTFOLIO**  [https://johnery.com/](https://johnery.com/)  [https://www.instagram.com/johnerycreatives/](https://www.instagram.com/johnerycreatives/)  **LET'S CHAT**  [contact@johnery.com](mailto:contact@johnery.com)  **ABOUT ME**  Hi everyone! I'm John, a freelance graphic designer who has worked with many clients on a multitude of projects over the past few years. Versatility is one of my key strengths. Whether it’s a modern approach or something more casual, I believe I have the skills and knowledge to meet your needs.  **MY CLIENTELE AND SERVICES**  I design for  * Businesses and Startups * Streamers and YouTubers * Authors and Comic Creators  I also provide standalone services, such as  * Logo Design and Branding * Marketing Materials * Web Design  **RATES**  Pricing is dependent on the scale, budget, and scope of work for the project. I usually charge a flat rate based on my hourly rate is $30 per hour. Don't hesitate to contact me for a quote and we can discuss further.  I'm currently available for new projects, If you're interested or have any questions, feel free to send me a message and I'll try to help as best as I can. Looking forward to hearing from you!",2,1,1756900641,https://www.reddit.com/r/forhire/comments/1n7cs9q/for_hire_experienced_and_versatile_graphic/
1n79sey,forhire,[hiring] German Speakers for recording project,"Job Offer: German Speakers Needed  We are looking for native German speakers to record five short English sentences in a German accent. 	•	Task duration: 15–20 minutes 	•	Payment: $15 USD per task via PayPal every Sunday after approval.  	•	Requirement: Must be a German speaker  If you’re interested, please send me a direct message!",3,1,1756890270,https://www.reddit.com/r/forhire/comments/1n79sey/hiring_german_speakers_for_recording_project/
1n7gdrz,forhire,[For Hire] Tech Sales/Lead Generator Expert,"$15/hr - My process is simple straight forward  1. Define the target profile (industry, company size and budget indicators). 2. Research their website, LinkedIn or any available social channels to gather information about the company and the decision makers. 3. Collect necessary information that would enable me to contact them and populate it on a Google Sheet. 4. Qualify these leads by checking their website, social media presence, and search visibility. If a company isn't showing up on Google, doesn't run ads, or posts irregularly on LinkedIn, those are clear signs of marketing gaps. 5. Update the Google sheet with companies that fit the criteria, and email the ceo with the information I have found, and proceed to establish contact on his instruction. All outreaches would be tracked on your CRM of choice.  To nurture the leads:  1. I would research deeper to know in particular the marketing gaps I can find out, including website performance, social media presence and local seo. 2. With what I have found out, I would create an email sequence for three weeks (3 times per week). Then start with a personalized outreach, followed by the sequence of emails. 3. I will also include cold calling. Once they show interest, I brief the ceo with all details (pain points, signals of budget, and engagement history) so they can step into the call fully informed.  Send me a DM if you will be needing my service.",1,1,1756909844,https://www.reddit.com/r/forhire/comments/1n7gdrz/for_hire_tech_saleslead_generator_expert/
1n7g8e5,forhire,"[FOR HIRE] 📣 Offering 1:1 Job Search Support - Resumes, Interview Prep, Salary Negotiation &amp; More 🧠💼","Hey everyone – I’m the owner of a boutique executive search firm and have spent years helping candidates land roles from entry-level to VP across a range of industries including tech, manufacturing, banking, healthcare, and more.  I’m now offering personalized, 1:1 support for job seekers who are feeling stuck, overwhelmed, or just need a strategic edge in today’s job market.  Whether you're applying for your first job, switching industries, or aiming for a leadership role, I’ve helped professionals navigate every step of the process:  ✅ Resume Recreation &amp; Optimization: tailored to the role, ATS-friendly, and achievement-oriented ✅ Interview Prep: from behavioral interviews to executive-level presentations ✅ Salary Negotiation: clear, confident strategies to secure higher offers ✅ Elevator Pitch Coaching: sharpen how you introduce yourself in interviews or networking ✅ LinkedIn Profile Refresh: make recruiters come to you ✅ End-to-End Job Search Strategy: know what to apply for, how to follow up, and when to pivot  I offer flexible packages and hourly sessions ($50-$100 per hour) based on your goals. Whether you want one quick session or a structured multi-week plan, I’m happy to meet you where you are.  👉 DM me if you're interested, or drop a comment with questions – happy to help however I can.  Let’s get you unstuck and into the role you deserve 🙌",1,1,1756909492,https://www.reddit.com/r/forhire/comments/1n7g8e5/for_hire_offering_11_job_search_support_resumes/
1n7bara,forhire,[For Hire] Professional Logo &amp; Graphic Design Services at Competitive Prices,"Hi everyone! Looking to elevate your brand with a standout visual identity? With years of experience creating memorable brands for both startup and established businesses, you've just found your graphic designer!  **My** [**PORTFOLIO**](https://evilsqueak.carrd.co/) and client feedback at [r/testimonials](https://www.reddit.com/r/testimonials/search/?q=DryConcert595&amp;cId=c26b5c48-99c9-4ee7-acf2-13434af19030&amp;iId=4fce0e13-b548-470c-9203-8d5bdd7b0ab3)  # What I Provide and Why Choose Me:  * **Unique logo designs** tailored to your brand in scalable vector format. * **Branding Identity and Social Media Kits**. A set of marketing and digital assets such as business cards, brochures, flyers etc or social media graphics that define how your brand presents itself and effectively communicate. * **Strong command of the English language**. ensuring clear communication throughout the design process, making it smooth and collaborative, and allowing for seamless incorporation of client feedback. * **Sense of professionalism**. Along with a quick turnaround, I’m dedicated to ensuring your vision is captured and delivered perfectly. No guesswork, no missed marks. * **Proficiency** in Adobe Illustrator, Photoshop and Indesign  Friendly rates start at $150-$200 for a basic logo package and upwards for a full branding package. The cost may vary depending on the project's scope and complexity. We can always discuss what fits within your budget, but rest assured, you’ll receive exceptional quality!  My [Email](mailto:evilsqueek@gmail.com) and [vgen.co/evilsqueek](http://vgen.co/evilsqueek)  If you’re ready to enhance your brand, feel free to reach out. I'd love to hear about your project and excited to see what we will create together.",2,1,1756895867,https://www.reddit.com/r/forhire/comments/1n7bara/for_hire_professional_logo_graphic_design/
1n7fydl,forhire,[For Hire] Will look for clients for you.,Wanting to aggresively market your service? For $20/day. I will be the one to look for clients. Just give me your info and the samples of your work. Will only take part time work for now. DM me for exact details.,1,4,1756908828,https://www.reddit.com/r/forhire/comments/1n7fydl/for_hire_will_look_for_clients_for_you/
1n78vwa,forhire,[Hiring] a browser automation expert ($100-$400),"# Job Post: AI-Powered Browser Automation Agent Developer  We are seeking a highly skilled and detail-oriented developer to build a custom browser automation agent. This role involves creating a robust and intelligent script to automate our lead generation and outreach process on Twitter, using our existing lead lists on drippi.ai.  The ideal candidate will have a strong background in browser automation, API integration, and an understanding of AI-driven personalization. This is a project-based role with the potential for long-term collaboration.  # Responsibilities:  * **Browser Automation:** Develop and maintain a reliable browser agent capable of navigating to [`drippi.ai`](http://drippi.ai), accessing a specific lead list, and iterating through leads one by one. * **Social Media Interaction:** Implement logic to programmatically check if direct messages (DMs) are open for each lead on their Twitter profile. * **Automated Messaging:** Integrate a three-message template script that will be automatically sent to leads with open DMs. The script must be capable of inserting the lead's first name and integrating AI-driven personalization. * **Volume Management:** Ensure the agent can successfully process and message 100 new leads per day. * **Follow-up System:** Design and implement a follow-up sequence, ensuring each lead receives a total of 7 follow-up messages over a one-month period. * **Data Tracking:** Create a system to accurately track which leads have been messaged, the status of their DMs, and the progress of the follow-up sequence. This system should prevent duplicate messages and ensure all messages are delivered correctly.  # Required Skills &amp; Experience:  * Proven experience with browser automation frameworks such as Puppeteer, Selenium, or Playwright. * Strong proficiency in a relevant programming language (e.g., Python, JavaScript). * Experience with Twitter's API or a deep understanding of web scraping to interact with the platform. * Knowledge of data management and database solutions for tracking outreach progress. * Familiarity with AI personalization techniques is a plus. * Excellent problem-solving skills and attention to detail.  # How to Apply:  If you are a passionate and experienced developer who is excited by the challenge of building intelligent automation systems, please submit your resume and a brief overview of a relevant project you have worked on.",3,5,1756886636,https://www.reddit.com/r/forhire/comments/1n78vwa/hiring_a_browser_automation_expert_100400/
1n7fkkl,forhire,[HIRING] APP DEVELOPER - NEED APP SIMILAR TO AIRTEL THANKS,"Heyy, I have a client from Afghanistan. He needs an app like the Airtel Thanks app.   Platform - Android and IOS  Budget - 100k Rupees  Yeah ik this is super vague but DM for details  Dm for more details.",1,6,1756907932,https://www.reddit.com/r/forhire/comments/1n7fkkl/hiring_app_developer_need_app_similar_to_airtel/
1n78rva,forhire,[HIRING] Appointment setter - UK/USA Based,"Hey everyone,   I require a UK based appointments setter to call from a list of UK businesses to arrange appointments for us to see them. We are a marketing agency running ads for roofing/ landscaping clients in the UK and USA     Please get in touch if you are interested in this position. We pay £100-250 per appointment and you can work the hours you choose. DM for more details. Thank you for reading",4,1,1756886206,https://www.reddit.com/r/forhire/comments/1n78rva/hiring_appointment_setter_ukusa_based/
1n7eywe,forhire,[Hiring] Anyone here work in sales or BD for fintech/crypto/trading platforms?,"I’m part of a remote-first team scaling a global trading platform (FX + crypto).  We’re currently expanding into new markets and I’m looking to connect with people who’ve done: – Business development or sales (ideally performance-based) – Affiliate management / IB onboarding – Community growth (Telegram, Discord, etc.) – Remote sales in crypto/fintech space  This isn’t a 9–5 job — but it’s fully remote, with commission + base for people who bring results (base salary $1000-3000 depending on the region you’re from).  You’d get: ✅ Personal CRM + onboarding tools ✅ Monthly commissions (real ones — not the scammy broker kind) ✅ Global support team &amp; fast approvals ✅ Flexible hours  We’ve seen great traction in SEA, LATAM, MENA, and EU.  If you’ve ever done sales, worked with traders, or helped onboard partners for brokers/exchanges — this could be interesting.  DM me or drop a comment and I’ll share more (no hard pitch, just want to see if there’s a fit).",0,3,1756906462,https://www.reddit.com/r/forhire/comments/1n7eywe/hiring_anyone_here_work_in_sales_or_bd_for/
1n7dyl6,forhire,"[For Hire] Freelance Web Development – Business Websites, Landing Pages, E-Commerce","Hello, I’m a freelance web developer available to take on projects. If you’ve been thinking about getting a website or improving the one you already have, I can help you.  Here’s what I can do for you:  * Build clean, modern, and responsive websites * Create landing pages designed to convert visitors into clients * Set up online stores with smooth checkout and product management * Optimize sites for speed, SEO, and mobile usability * Add custom features like booking systems, contact forms, or user accounts  Why work with me?  * Quick turnaround times * Affordable pricing tailored to your project * Clear communication and reliable delivery * Flexible – I’ll adapt to your ideas and requirements  If you’d like to work together, just send me a message with a short description of your project.  Message me for portfolio  Looking forward to helping you bring your ideas online!",1,1,1756903905,https://www.reddit.com/r/forhire/comments/1n7dyl6/for_hire_freelance_web_development_business/
1n79lwi,forhire,[HIRING] Upwork Business Developer – Remote Role,"We’re a **US-based AI/Data Science company** looking for an experienced **Business Developer / Upwork Bidder** to help us grow.  ✅ **What we’re looking for:**  * Proven experience in **winning projects on Upwork** (especially in Data Science / AI). * Strong communication &amp; client management skills. * Technical expertise in AI/ML is a bonus, but not required.  ✅ **What we offer:**  * We operate **multiple Top Rated Upwork accounts**. * Fully **remote role** (with potential onsite opportunities in the future). * **Competitive pay** with higher rates for experienced candidates who bring real value.  If this sounds like a fit, drop a comment or DM me  we’d love to connect. 🚀",2,3,1756889544,https://www.reddit.com/r/forhire/comments/1n79lwi/hiring_upwork_business_developer_remote_role/
