id,subreddit,title,selftext,score,num_comments,created_utc,permalink
1n8n5rg,forhire,"[HIRING] Short-Form Video Editor ($6–$8 per short, ongoing work)","Hello,  We’re **Rick ’N’ Rory**, daily streamers from the UK. We upload TikToks every single day and are launching a brand-new shorts series.  We’re looking for a **short-form video editor** to join our team.  **Details:**  * Budget: $6 per short (≤61s) / $8 per short (&gt;61s) * Ongoing work (we already have 4 editors and need another) * You’ll be provided timestamps, a voiceover, and footage * Knowledge of Football (Soccer), FIFA, and Career Mode is a plus (not essential) * We require a **free 15-second trial edit** to assess fit  If you’re interested, please **DM us with your portfolio** and we’ll set up a quick trial.  Thanks!",1,12,1757022249,https://www.reddit.com/r/forhire/comments/1n8n5rg/hiring_shortform_video_editor_68_per_short/
1n8n4cf,forhire,[For Hire] Need help with assessments? $50 I’ll take your test.,"A lot of companies like to use cognitive assessments, aptitude tests, personality tests etc. as part of their interview processes.   I know this because I’ve done hundreds of them for myself and others.  I’m very good at these tests and I can help you too.  Also, I think it’s kinda bullshit that they make us take them. I know plenty of people who are terrible at math and solving puzzles, but are very good at their jobs.  I’m currently in between jobs/looking for income and wondered if any interviewing redditors would want my services. $50/test, but price is negotiable - I know being on the job hunt sucks. Feel free to DM me and we’ll make sure that company knows how smart you are before that next interview.  -TINS",1,1,1757022152,https://www.reddit.com/r/forhire/comments/1n8n4cf/for_hire_need_help_with_assessments_50_ill_take/
1n87dka,forhire,[Hiring] Chat Engagement Specialist - Turn 7.5% Commissions into like a $15+ hour! (Full time),"High-Paying Opportunity – Work With a Top Global Team  * Weekly payouts – always on time * Reliable, steady income you can count on  **What we’re looking for:**  * Fast English typing skills (65+ WPM) * Fluent in English * Motivated, reliable, and committed individuals * Experience in Sales is a plus!  If you’ve got the drive, we’ve got the opportunity. DM us now!",5,11,1756984739,https://www.reddit.com/r/forhire/comments/1n87dka/hiring_chat_engagement_specialist_turn_75/
1n82m34,forhire,"[HIRING] [REMOTE] - Content Review Expert; 45$/hr US, UK, Canada, Australia","We're Hiring Talented Individuals Reviewing Experts in Numerous categories  **Ideal fit:**  * Have experience in one or more of these **archetypes**: technical writers, editors, research analysts, academic editors, content reviewers, legislative analysts, reading‑comprehension specialists, assessment authors, curriculum designers or instructional designers. * Have demonstrable experience creating Q&amp;A, summaries, or problem‑solving tasks for long‑form content. * Excel at deep reading and quickly synthesizing information across a variety of domains. * Possess strong fact‑checking and editing skills to validate and polish AI‑generated answers. * Apply analytical judgment to spot inconsistencies, gaps, or misinterpretations in draft outputs. * Communicate crisply in writing, producing clear, concise, well‑structured answers and maintain high attention to detail.     We're looking for **SERIOUS INDIVIDUALS** that are interested in this position **DM** me mentioning the job title so I know you read it.  An upvote would be appreciated to help reach this to individuals that are interested.",9,2,1756966906,https://www.reddit.com/r/forhire/comments/1n82m34/hiring_remote_content_review_expert_45hr_us_uk/
1n8hibp,forhire,[For Hire] Tech Sales/Lead Generator Expert,"$15/hr - My process is simple straight forward  1. Define the target profile (industry, company size and budget indicators). 2. Research their website, LinkedIn or any available social channels to gather information about the company and the decision makers. 3. Collect necessary information that would enable me to contact them and populate it on a Google Sheet. 4. Qualify these leads by checking their website, social media presence, and search visibility. If a company isn't showing up on Google, doesn't run ads, or posts irregularly on LinkedIn, those are clear signs of marketing gaps. 5. Update the Google sheet with companies that fit the criteria, and email the ceo with the information I have found, and proceed to establish contact on his instruction. All outreaches would be tracked on your CRM of choice.  To nurture the leads:  1. I would research deeper to know in particular the marketing gaps I can find out, including website performance, social media presence and local seo. 2. With what I have found out, I would create an email sequence for three weeks (3 times per week). Then start with a personalized outreach, followed by the sequence of emails. 3. I will also include cold calling. Once they show interest, I brief the ceo with all details (pain points, signals of budget, and engagement history) so they can step into the call fully informed.  Send me a DM if you will be needing my service.",1,1,1757009125,https://www.reddit.com/r/forhire/comments/1n8hibp/for_hire_tech_saleslead_generator_expert/
1n7ogbe,forhire,[HIRING] Looking for people to practice interviewing at my company [$30 per half hour],"Hey all! I am the founder of an IT consulting company, and we're looking to improve our regular employee hiring process. I believe in doing everything ethically, so to that end, rather than have people interview for roles that don't exist (Ghost postings), or wasting people's time &amp; making terrible first impression, I'd like to pay people to interview!  The budget is **$30 per interview**, **should only be a half hour**, and we will aim to do a few of them. The goal is to get feedback on our process &amp; company, so to that end:  * list out what you liked, what you did not like, ways we can improve, etc * It will be a 30 minute teams call, meeting with myself and head of operations. **Webcam preferred, but not required. I myself will be on video.** * We have several positions you can interview for: **Assistant, Technical Lead, Software Developer, Marketing lead**. Please DM me which role you'd be interested in mock interviewing for. * Please submit a resume for the role. **No experience necessary!** * Lastly, even though the goal is to get honest feedback about us as a company &amp; our processes, we DO want you to have fun, so feel free to share your background, resume, hobbies, etc,  If you like, we can optionally give you feedback about how you interviewed as well, to help you with an actual interview. We understand interviews are stressful, so hopefully by paying for them and lowering the stakes, we can ensure a good experience for you, as you help us make things better. Thanks!",63,131,1756927790,https://www.reddit.com/r/forhire/comments/1n7ogbe/hiring_looking_for_people_to_practice/
1n8frgd,forhire,"[FOR HIRE] I'm a Web Developer - Experience in NextJs, Wordpress, WooCommerce &amp; Shopify - $20/hr","**Hi, I’m a Web Developer with 6+ years of experience** delivering fast, scalable, and user-friendly websites and applications. I’ve worked with startups, agencies, and enterprises, helping them launch products, grow online, and streamline operations.  **- Skills &amp; Expertise**  * WordPress, WooCommerce, Shopify * PHP, Laravel, React.js, Vue * Stripe, PayPal, and custom payment integrations  **- My Services**  * Custom website &amp; application development * E-commerce solutions (WooCommerce &amp; Shopify) * SaaS dashboards &amp; API integrations * Payment gateway setup (Stripe, PayPal, subscriptions) * Support, maintenance, bug fixing, and product uploads  I focus on writing clean, maintainable code and delivering projects on time, ensuring every solution is optimized for performance and growth.  **Email:** [marsh.biz@yahoo.com](mailto:marsh.biz@yahoo.com)  **Portfolio:** [behance.net/kipruto](http://behance.net/kipruto)",0,1,1757005182,https://www.reddit.com/r/forhire/comments/1n8frgd/for_hire_im_a_web_developer_experience_in_nextjs/
1n86mjd,forhire,[For Hire] Performance Marketing Consultant | 9+ Years of Experience Scaling 7-8 DTC and SaaS Brands in the US &amp; UK | $45/hr,"I'm a Performance Marketing Manager who's spent 9+ years turning underperforming ad accounts into high-ROAS growth machines. While others chase vanity metrics, I focus on what actually matters: **profitable scale**.  **Recent Client Wins:**  * Engineered campaigns delivering **3-4X ROAS consistently** across Meta, Google &amp; TikTok * Cut customer acquisition costs by **30%** while driving 15-30% YoY growth * Managed **$5M+ annual budgets** across DTC and SaaS brands in US, UK &amp; EU * Boosted AOV by **45% YoY** through targeted segmentation and personalized creative  **Industries:** Beauty • Food &amp; Beverage • Fashion • Luxury Goods • SaaS  **Platforms:** Google Ads • Meta • TikTok • YouTube • Reddit  While agencies throw spaghetti at the wall, I use **data-driven attribution models** and **continuous creative testing** to ensure every dollar works harder—no fluff, no excuses—just sustainable, compounding growth.  Ready to stop wasting ad spend and start scaling profitably?  DM me with your current ROAS and monthly ad spend. Happy to answer questions about scaling paid ads.  CV and work portfolio upon request.",3,1,1756982247,https://www.reddit.com/r/forhire/comments/1n86mjd/for_hire_performance_marketing_consultant_9_years/
1n8dswo,forhire,[For Hire] 10-Min YouTube Video Editor | 24h Delivery | $100-200,"I edit 10-min YouTube content in 24h. Meme style, commentary, reaction, vlogs, gaming.   Clean cuts, solid pacing.  I know how to drive views, retention through better storytelling, pacing. Editing is only my tool.   You can check my past work  https://youtube.com/@bruceeditsvideos?si=6pWErlVka_e7ymTZ  Ifit fits your vibe, hmu!   $100–$200 depending on project 24h delivery DM if you're interested!",1,1,1757000796,https://www.reddit.com/r/forhire/comments/1n8dswo/for_hire_10min_youtube_video_editor_24h_delivery/
1n8dcyt,forhire,"[For Hire] Skilled Writers, Editor and Legal Writer with proven experience.","Hello!   I’m a multiple-time published skilled writer and editor with strong expertise in **academic writing, legal research, and content creation**. With proven experience in producing **high-quality, well-researched, and polished work**, I specialize in:  * **Academic &amp; Research Writing** – Research papers, articles, case studies, and essays * **Legal Writing &amp; Research** – Case briefs, legal articles, research papers, and analysis of statutes/judgments * **Content Writing &amp; Editing** – Blog posts, website content, professional documents, and proofreading * **Formatting &amp; Referencing** – OSCOLA, APA, MLA, Bluebook, and other citation styles  🔹 **Why Work With Me?**  * Strong academic background in law and social sciences * Experienced in handling complex research and turning it into clear, structured, and engaging writing * Commitment to **accuracy, originality, and timely delivery** * Flexible in adapting tone academic, professional, or creative based on your needs  **Let’s Work Together!**   If you’re looking for a dedicated and detail-oriented writer/editor to assist with your project, feel free to reach out.  * DM me with your project details or if you want my resume. * Open to both **short-term gigs and long-term collaborations**.  Rate : It can be negotiated but the lowest I can go is USD 15/hr. Of course ot will majorly depend on the work itself.",1,1,1756999801,https://www.reddit.com/r/forhire/comments/1n8dcyt/for_hire_skilled_writers_editor_and_legal_writer/
1n8cum8,forhire,"[For Hire] Need Leads? I Deliver Fast, Accurate US Business Leads You Can Use Today","Hi there,  I provide verified business leads in the US, mainly California, Texas, and Florida, though I can cover other states too. Each lead comes with as much information as I can find: business name, email, phone number, website, owner or CEO name, social media links, and the address.  I charge $0.70/lead for regular orders, and if you need a larger batch, we can negotiate a discount. I focus on delivering fast, accurate, and reliable leads that you can use straight away.  If you’re interested or want to discuss bulk orders, just send me a message and we’ll get it sorted.",1,1,1756998654,https://www.reddit.com/r/forhire/comments/1n8cum8/for_hire_need_leads_i_deliver_fast_accurate_us/
1n80h4q,forhire,"[Hiring] Graphic Designer &amp; Social Media Content Creator (6-Month Contract, Nutraceutical Brand) $25/hr","Hello creative professionals!  I'm looking for a skilled Graphic Designer &amp; Social Media Content Creator to produce premium, engaging content for a high-end nutraceutical brand. This is a 6-month contract position (with potential to extend)—compensation is per project or per reel, and fully negotiable based on experience and quality.   ---  Role Overview  Social media posts — static images &amp; carousel designs  Instagram Stories  High-quality Reels &amp; short videos  Interactive/futuristic visuals — think 3D mockups, creative motion elements  Educational + promotional content tailored for Instagram    ---  What We're Looking For  Proven experience in social media design, especially Reels  Proficiency in:  Adobe Photoshop, Illustrator  After Effects, Premiere Pro  Canva and/or Figma   Strong ability to create high-end, branded visuals with a consistent aesthetic  Deep understanding of Instagram trends and engagement strategies  Bonus: Motion graphics and/or 3D design skills    ---  Project Terms  Compensation: Paid per project or per reel—let’s negotiate based on deliverables and skill level  Duration: 6 months (with opportunity to extend based on performance)  Deliverables: Timely delivery of assets—still image posts, stories, Reels, and interactive visuals as needed    ---  Interested? Please Share  Your portfolio or examples of relevant work (Reels, motion design, Instagram content, etc.)  A brief note on your approach to branded, trend-focused content  Your availability and rate expectation   Looking forward to seeing your creative spark—thanks for reading!",8,10,1756959415,https://www.reddit.com/r/forhire/comments/1n80h4q/hiring_graphic_designer_social_media_content/
1n8c71y,forhire,Complete Mobile app developer: 30$/hr  [For Hire],"Experienced Software engineer. Can build end-to-end software solutions with OpenAI and LLM integration. I also have a complete app on the Apple app store and have built several MVP's for YC combinator entrants, I cannot disclose the projects due to NDA but can give a better idea on a video call   [https://apps.apple.com/us/app/ummati-halal-shopping/id6472885158](https://apps.apple.com/us/app/ummati-halal-shopping/id6472885158)  I can build complete mobile apps as well as websites, with Payments, low cost of hosting",1,2,1756997201,https://www.reddit.com/r/forhire/comments/1n8c71y/complete_mobile_app_developer_30hr_for_hire/
1n8bae6,forhire,[FOR HIRE] SaaS SEO Specialist - $35/hr - $60O audits,"I help SaaS businesses grow signups and MRR through SEO and AI search. Former in-house SEO at a major SaaS, I will share the playbooks all big players use and guide you through implementing them.   **What I can do for you, in detail:**  * **SEO Strategy &amp; Roadmaps** – Clear, prioritized plan that shows exactly what to do first, second, and third to drive signups and user acquisition. * **International SEO**  – International SEO setup fixes (hreflang, site structure, localization), launch in new markets without SEO disasters * **Technical SEO** – I identify and prioritize the fixes that actually impact signups and MRR, then work with your dev team to implement them or implement them myself  * **AI Search Optimization** – Track visibility across AI tools and create a plan for citation building and content restructuring, so your SaaS shows up when prospects research solutions in your category * **Analytics &amp; Forecasting** – Dashboards/reports that connect organic traffic to signups, conversions, and MRR. So you can measure ROI and create a repeatable system.  Currently available for new clients. These are promotional prices, I usually charge more - grab them while you can.   **Rates:**  * $35/hr (ongoing work, consulting, strategy, implementation) * $600 flat for a full SEO audit  Happy to share case studies and testimonials. Don't be shy, DM me",1,1,1756995143,https://www.reddit.com/r/forhire/comments/1n8bae6/for_hire_saas_seo_specialist_35hr_60o_audits/
1n8ao3r,forhire,"[FOR HIRE] 🚀 Need automation, a chatbot, or custom AI for your business? Let me build it.","Hey folks,  I build **automation systems, AI-powered chatbots, and custom software** for businesses. If you’ve ever thought *“there has to be a smarter way to do this”*—that’s where I come in.  ✅ **Chatbots that actually work** (no more clunky “press 1 for this” nonsense)   ✅ **Business process automation** (stop wasting hours on repetitive tasks)   ✅ **Custom AI tools** (recommendation engines, data insights, integrations)   ✅ **Web + backend solutions** (React, FastAPI, SQL, you name it)  I don’t just drop a bot and vanish—I design systems that **save time, cut costs, and actually scale.**  💡 Examples of what I can build for you:  * A restaurant chatbot that recommends meals based on budget/diet * An assistant that monitors websites and notifies you when opportunities pop up * Inventory management tied directly into customer chat experiences * Custom AI dashboards to give you insights without manual digging  If your business could use more time, smoother workflows, or a “digital employee” that never sleeps, shoot me a DM.  ⚡ Small businesses, startups, and solo founders—I’ve got you covered.  Let’s make your operations run smarter, not harder.",1,1,1756993819,https://www.reddit.com/r/forhire/comments/1n8ao3r/for_hire_need_automation_a_chatbot_or_custom_ai/
1n84mrt,forhire,"[Hiring] Looking for a Manhua Recap Script Writer (Low Budget, India Only)","Hi, I recently got monetized on YouTube and run a manhua recap channel. Right now, I handle everything alone — editing, script writing, voice setup — so I’m looking for a partner/friend to help me with script writing.  💡 Details:  I need scripts written in third-person narration, recap style (copyright-safe).  Payment will be low at the start since I just got monetized, but as the channel grows, your pay will increase.  You must be from India so I can pay easily via PhonePe / Google Pay.   If you’re confident in writing manhua recap scripts and want to grow with me, DM me.",2,1,1756974828,https://www.reddit.com/r/forhire/comments/1n84mrt/hiring_looking_for_a_manhua_recap_script_writer/
1n88j1q,forhire,"[Hiring] [Onsite] [Japan]-Software Engineers (Visa Holders Only, Multiple Cities) Roughly $18/hour based on 40hr/week]","\###################################################################   Please note:   \###################################################################  The annual income figures are only examples and may vary depending on your skill set, Japanese language ability, and other factors. Specific terms and conditions can be negotiated during the interview.   Only candidates who reside in Japan and are able to work onsite five days a week are eligible for employment. While full remote work may be possible depending on the project or work situation, it is limited to those residing in Japan.   Visa Requirement: Must already hold a valid Japanese work visa. No sponsorship.   Required Japanese Level (Minimum): Business-level (equivalent to JLPT N2 or higher).  ▼▼▼▼▼▼▼▼▼▼▼▼▼▼▼▼▼▼▼▼▼▼▼▼▼▼▼▼▼▼▼▼▼▼▼▼▼▼▼▼▼▼▼▼   If you can't read the following job posting without using a translator, then your Japanese is not at a business level. Our work relies heavily on Japanese for meetings and documentation. Business-level Japanese is therefore a requirement.   ▲▲▲▲▲▲▲▲▲▲▲▲▲▲▲▲▲▲▲▲▲▲▲▲▲▲▲▲▲▲▲▲▲▲▲▲▲▲▲▲▲▲▲▲  ■会社名 : 株式会社グッドワークス [https://www.good-works.co.jp/](https://www.good-works.co.jp/)  ■所在地   〒101-0025 東京都千代田区神田佐久間町1-11 産報佐久間ビル2F   〒541-0058 大阪府大阪市中央区南久宝寺町3丁目2-7 第一住建南久宝寺町ビル602号   〒460-0008 愛知県名古屋市中区栄2-2-1 広小路伏見中駒ビル5F   〒980-0811 宮城県仙台市青葉区一番町2-6-1 シティハウス一番町中央2F   〒812-0011 福岡県福岡市博多区博多駅前二丁目17-1 博多プレステージ本館2F  ■連絡先：Feel free to DM me or email me at [m.kim@good-works.co.jp](mailto:m.kim@good-works.co.jp)  ■勤務時間： 10:00～19:00 ※プロジェクトにより変動あり  ■時給および月給 ＜中途入社社員の年収UP事例＞\*\*※\*\*変動あり   Javaエンジニア（45歳）：★年収180万円UP（450万円 ⇒ 630万円）   C#・.NETエンジニア（33歳）：★年収160万円UP（420万円 ⇒ 580万円）   Reactエンジニア（28歳）：★年収150万円UP（350万円 ⇒ 500万円）  ■給与に加算される手当・インセンティブ   交通費支給（最大月5万円）   家族手当、資格手当（当社規定による） 役職手当 美容手当（月3,000円）   在宅勤務手当、書籍購入手当 ■賞与：年2回（6月・12月）  ■昇給：年1回（4月）   ■入社時の想定年収：年収360万円～900万円   ■応募資格 就労可能なビザをお持ちの方（就労ビザ・配偶者ビザなど）   ※IT業界の実務経験者は優遇  ■仕事内容（業種）   当社は2007年に設立され、今年で18年目を迎えるITソリューション専門企業です。 東京を拠点に、大阪・名古屋・福岡など全国で事業を展開しており、 多様な開発・インフラ・教育プロジェクトを通じて、 お客様とエンジニアの双方から信頼されるパートナーとして成長してまいりました。 グッドワークスでは、実力あるエンジニアが自らのキャリアを主体的に描けるよう、 安定した環境と多彩なプロジェクトの機会を提供しています。 現在、当社には日本国内で活躍中の多国籍エンジニアが多数在籍しております。 日本での就労ビザをお持ちのIT経験者の方でご興味のある方は、お気軽にご連絡ください。 私を通じてご入社された方には、特別な特典もご用意しております。 ご興味のある方は、ぜひご連絡ください。  \###################################################################   Please note:   \###################################################################  The annual income figures are only examples and may vary depending on your skill set, Japanese language ability, and other factors. Specific terms and conditions can be negotiated during the interview.   Only candidates who reside in Japan and are able to work onsite five days a week are eligible for employment. While full remote work may be possible depending on the project or work situation, it is limited to those residing in Japan.   Visa Requirement: Must already hold a valid Japanese work visa. No sponsorship.   Required Japanese Level (Minimum): Business-level (equivalent to JLPT N2 or higher).",1,1,1756988228,https://www.reddit.com/r/forhire/comments/1n88j1q/hiring_onsite_japansoftware_engineers_visa/
1n7sc7a,forhire,[HIRING] Remote Airbnb Assistant – U.S. &amp; Canada | Training Provided $25-$30,We’re hiring remote assistants to help manage Airbnb listings and guest communication. Flexible part-time (3–4 hrs) or full-time (6–7 hrs) shifts available.  * **Location**: U.S. or Canada * **Training**: Provided * **Payouts**: Daily or weekly (via bank transfer)  **To apply**: Please **message me on Reddit** with **your location**.,8,16,1756936790,https://www.reddit.com/r/forhire/comments/1n7sc7a/hiring_remote_airbnb_assistant_us_canada_training/
1n85i91,forhire,[hiring] Looking for Student Scouts,"Starting an online coding academy. Need people to bring in students If you get 15 signups, you get $50. easy  just find folks who wanna learn coding. DM if interested",0,2,1756978180,https://www.reddit.com/r/forhire/comments/1n85i91/hiring_looking_for_student_scouts/
1n8406i,forhire,"[FOR HIRE] Fast &amp; Affordable Photo Editing (Retouching, Background Removal, Funny Edits &amp; More)","I’m offering **quick and reliable photo editing services**. If you need your pictures polished, tweaked, or even turned into something fun, I can help!  What I can do:  * **Background removal / replacement** * **Skin retouching &amp; blemish fixes** * **Color correction &amp; lighting adjustments** * **Object removal / cleanup** * **Funny / creative edits (memes, surreal edits, silly Photoshop fun)** * **Simple graphic tweaks (text, overlays, resizing, etc.)**  Turnaround: Same day (often within a couple of hours)   Pricing: **$3 per image** (bulk discounts available)   Payment: PayPal  DM me with your photos and ideas, and I’ll get started right away!",1,1,1756972314,https://www.reddit.com/r/forhire/comments/1n8406i/for_hire_fast_affordable_photo_editing_retouching/
