id,subreddit,title,selftext,score,num_comments,created_utc,permalink
1n83xy2,forhire,[For Hire] Tech Sales/Lead Generator Expert,"$15/hr - My process is simple straight forward  1. Define the target profile (industry, company size and budget indicators). 2. Research their website, LinkedIn or any available social channels to gather information about the company and the decision makers. 3. Collect necessary information that would enable me to contact them and populate it on a Google Sheet. 4. Qualify these leads by checking their website, social media presence, and search visibility. If a company isn't showing up on Google, doesn't run ads, or posts irregularly on LinkedIn, those are clear signs of marketing gaps. 5. Update the Google sheet with companies that fit the criteria, and email the ceo with the information I have found, and proceed to establish contact on his instruction. All outreaches would be tracked on your CRM of choice.  To nurture the leads:  1. I would research deeper to know in particular the marketing gaps I can find out, including website performance, social media presence and local seo. 2. With what I have found out, I would create an email sequence for three weeks (3 times per week). Then start with a personalized outreach, followed by the sequence of emails. 3. I will also include cold calling. Once they show interest, I brief the ceo with all details (pain points, signals of budget, and engagement history) so they can step into the call fully informed.  Send me a DM if you will be needing my service.",1,1,1756972071,https://www.reddit.com/r/forhire/comments/1n83xy2/for_hire_tech_saleslead_generator_expert/
1n8dex9,forhire,[Hiring] Artist/AI artist to generate Medieval PRG item images for my cards.,"Looking for someone who can generate consistent models of items. You need to be good with prompts and occasional editing if the results are not right. The items must be provided on a blank background ready to use.    I need at least 2000 images which means \~333 items. (1 item = 6 images, one for each rarity)  **About the items:**   1. There are 6 item slots(Head, Torso, Legs, Feet, Hands, Cloak) and each slot has multiple item types. For example, the Head slot can have helmets, hats, crowns, masks.   2. Each item comes in 6 rarities Common-Uncommon-Rare-Epic-Legendary-Mythical(with their own color scheme)     **What do you need to do?**   You will need to generate the Common base first and improve it with each rarity. It is very important to keep the base consistency.    Example: You generate a Helmet. First you create the base which is Common and then adjust the base for each rarity.  Please try before messaging me and if you can generate consistent models we can negotiate the price.    If you message me please use a sample made by you.   Sub requires min 15/h, i will pay in bulk of minimum 10 items(60 images) after we negotiate.    Samples:   [https://ibb.co/bMYxmrcV](https://ibb.co/bMYxmrcV)  [https://ibb.co/j9kvyfW2](https://ibb.co/j9kvyfW2)  [https://ibb.co/Fbzw2pH3](https://ibb.co/Fbzw2pH3)  [https://ibb.co/S4QchSh6](https://ibb.co/S4QchSh6)  [https://ibb.co/272Ltgmd](https://ibb.co/272Ltgmd)  [https://ibb.co/vMrcTQw](https://ibb.co/vMrcTQw)  [https://ibb.co/RkZ18BJf](https://ibb.co/RkZ18BJf)",0,3,1756999925,https://www.reddit.com/r/forhire/comments/1n8dex9/hiring_artistai_artist_to_generate_medieval_prg/
1n82ak5,forhire,[FOR HIRE] Photographer - Photo and video editing,"Hey there everyone, my name is Ayaan!  I am a photographer and a psychology graduate from Pakistan. As a person I am a, driven, energetic, and dedicated psychology student with high aspirations, a passion for helping others and understanding human behaviour, as well as excellent communication and interpersonal skills. However, on the creative side of things, I have been doing photography for over a decade, simultaneously I have been editing pictures as well. I have currently been getting into videography and graphic designing as well.  I use software such as Adobe Lightroom Classic and photoshop. I have alot of love and passion for photography and I take my work very seriously. I will work on your pictures with alot of care, precision, accuracy and in alot of detail. My work speaks for itself and you can take a look at my portfolio to decide if my skills are worth the money or not. My Portfolio: [https://www.behance.net/ayaanshakir1](https://www.behance.net/ayaanshakir1)  As for the pricing of the work, I will work for $25/hr or per batch of 10 pictures but depending on the number of picture (if in bulk), the pricing can be discussed in further detail.",1,1,1756965719,https://www.reddit.com/r/forhire/comments/1n82ak5/for_hire_photographer_photo_and_video_editing/
1n7bpuv,forhire,"[Hiring] Looking for a graphic designer for logos, YouTube and other work.",Hello I am looking for a graphic designer(s) who can help me create a few different logos. In total I am looking to get work done for a YouTube Channel &amp; a podcast. My budget is $50-$100 per design.   What I want done is as follows:  Youtube  * Banner  * Profile Pic  Podcast  * Logo   If interested please don't hesitate to DM w/ a portfolio or any prior experience.   Thanks,33,64,1756897290,https://www.reddit.com/r/forhire/comments/1n7bpuv/hiring_looking_for_a_graphic_designer_for_logos/
1n7egcz,forhire,[Hiring] Remote Appointment Setters Wanted,"**🚀 We (AMAH CONNECTS) are Hiring Remote Appointment Setters 🚀**  We’re looking for motivated appointment setters to join our growing team. If you enjoy connecting with people and starting conversations that matter, this is your chance!  **What you’ll be doing:**      •	We’ll provide you with a steady flow of fresh, quality leads every day (no scraping, no guessing).          •	Starting natural conversations that lead to booked calls.  **What you’ll earn:**      •	💵 **$2 per qualified show-up**.          •	💰 **7% - 15% commission** on every deal closed (average deal size: $1,000+). (room for growth)  **Why is this worth it?**      •	You don’t need to hunt for people; we supply you with leads          •	Simple framework + training provided to keep it authentic (no robotic scripts).          •	Long-term growth opportunity for consistent performers.  **Who we want:**      •	People who can stay consistent and disciplined.          •	Setters who understand that a **“no” isn’t failure**, it just means keep going.          •	Communicators who can bring both personality and professionalism.  👉 1. Upvote   👉 2. DM me the word “**Setter**” if you’re ready to start.",21,9,1756905171,https://www.reddit.com/r/forhire/comments/1n7egcz/hiring_remote_appointment_setters_wanted/
1n7s794,forhire,[Hiring] a B2B focused Web Designer for Webpage Overhaul,"Hello Creatives:  Looking for a complete revamp and update to my current website at [CharlotteLEDPros.com](http://CharlotteLEDPros.com).  My company is a B2B organization that provides Energy Efficient LED Lighting to commercial customers (not residential) and I’m looking to completely revamp my current WordPress website hosted on GoDaddy.  I’m looking for a **hungry and talented  designer** who can do more than just polish up the look—  🔍 I want someone who can *analyze the current site*, point out what’s missing, and bring new, creative ideas to the table.  The site does NOT need to sell outright… only drive leads.  **Here’s what is expected:**  * **Audit my current website** and give detailed feedback on what can be improved (structure, layout, copy, branding, mobile UX, etc.).  * Come up with **a fresh, strategic, and creative redesign plan**.  * **Rebuild the site on GoDaddy** with smooth navigation, modern visuals, and clean functionality.  * Add elements that are currently missing — such as strong calls-to-action, better service explanation, featured work, etc.  * Keep SEO, speed, and mobile responsiveness in mind while designing.  **Necessary Skills:**  * Strong experience building **GoDaddy websites**  * Eye for **minimal, modern, and user-friendly design**   * Great communication &amp; open to feedback   💡 **Bonus Points If:**  * You’ve worked on B2B sites * You can bring in ideas from the world of brand design, storytelling websites, or service-led landing pages   📩 **How to Apply:**  Please send:  1. A few examples of WordPress websites you’ve built 2. A few quick points on what you’d improve on my current site (CharlotteLEDPros.com)   If you have questions, feel free to reach me directly at [davek@CharlotteLEDPros.com](mailto:davek@CharlotteLEDPros.com)  Thanks for reading!   Budget negotiable.  — Dave",3,7,1756936450,https://www.reddit.com/r/forhire/comments/1n7s794/hiring_a_b2b_focused_web_designer_for_webpage/
1n81mg9,forhire,[For Hire] Full-Stack End-to-End Developer | I build Apps for $4k/m,"Hi, my name is Bailey. I have been writing software for a long time. My job is to help people like you build great software without any hassles. All you have to do is click buy, and I’ll take care of the rest. No need to waste time working with amateurs who don’t know how to deliver a product. No need to pay an expensive consultant focused on increasing their billable hours.",0,1,1756963311,https://www.reddit.com/r/forhire/comments/1n81mg9/for_hire_fullstack_endtoend_developer_i_build/
1n7pcgy,forhire,[Hiring] 40 Remote Customer Support jobs (entry &amp; mid),"I wanted to help you all to find jobs so made a list of most recent remote entry &amp; mid-level Customer Support &amp; Success jobs. I hope this helps someone!  - [Customer Care Representative - Charlotte, NC (Full Time)](https://omnijobs.io/en/jobs/4649865?utm_source=reddit&amp;utm_medium=post&amp;utm_campaign=sep-4-cs) @ Duke Energy Indiana, LLC  - [Customer Service Advocate](https://omnijobs.io/en/jobs/4650364?utm_source=reddit&amp;utm_medium=post&amp;utm_campaign=sep-4-cs) @ Centene Management Company LLC     - 💰 $17 – $27/h  - [Bilingual Customer Service Representative (UT, 10/6 Start)](https://omnijobs.io/en/jobs/4655223?utm_source=reddit&amp;utm_medium=post&amp;utm_campaign=sep-4-cs) @ Prog Leasing LLC     - 💰 ~$17/h  - [Associate Customer Care Professional-Health Insurance, Remote](https://omnijobs.io/en/jobs/4658690?utm_source=reddit&amp;utm_medium=post&amp;utm_campaign=sep-4-cs) @ Thrivent Financial for Lutherans     - 💰 ~$23/h  - [Customer Service Representative - Call Center](https://omnijobs.io/en/jobs/4645891?utm_source=reddit&amp;utm_medium=post&amp;utm_campaign=sep-4-cs) @ GD Information Technology, Inc.     - 💰 $44K/y  - [Call Center Representative – Flexible Scheduling](https://omnijobs.io/en/jobs/4627049?utm_source=reddit&amp;utm_medium=post&amp;utm_campaign=sep-4-cs) @ Enterprise Call Center  - [CCSB Call Center Representative I](https://omnijobs.io/en/jobs/4613504?utm_source=reddit&amp;utm_medium=post&amp;utm_campaign=sep-4-cs) @ Western Growers Family of Companies     - 💰 $39–49K/y  - [Customer Support Representative](https://omnijobs.io/en/jobs/4607051?utm_source=reddit&amp;utm_medium=post&amp;utm_campaign=sep-4-cs) @ INDUS.AI     - 💰 $19 – $22/h  - [Customer Service Representative](https://omnijobs.io/en/jobs/4636650?utm_source=reddit&amp;utm_medium=post&amp;utm_campaign=sep-4-cs) @ Fortune Brands  - [AAA Remote Membership Representative](https://omnijobs.io/en/jobs/4619761?utm_source=reddit&amp;utm_medium=post&amp;utm_campaign=sep-4-cs) @ AAA NCNU     - 💰 ~$17/h  - [Customer Service Representative](https://omnijobs.io/en/jobs/4620372?utm_source=reddit&amp;utm_medium=post&amp;utm_campaign=sep-4-cs) @ TruBridge, Inc  - [Remote Customer Service Representative - Charleston, WV](https://omnijobs.io/en/jobs/4625207?utm_source=reddit&amp;utm_medium=post&amp;utm_campaign=sep-4-cs) @ Aetna Resources, LLC  - [Customer Service Representative - Remote, OK](https://omnijobs.io/en/jobs/4629560?utm_source=reddit&amp;utm_medium=post&amp;utm_campaign=sep-4-cs) @ ModivCare Solutions, LLC     - 💰 ~$14/h  - [Care Support Specialist I](https://omnijobs.io/en/jobs/4641679?utm_source=reddit&amp;utm_medium=post&amp;utm_campaign=sep-4-cs) @ The Elevance Health Companies, Inc.     - 💰 $16 – $28/h  - [Credit Card Customer Service](https://omnijobs.io/en/jobs/4646186?utm_source=reddit&amp;utm_medium=post&amp;utm_campaign=sep-4-cs) @ Discover Finl Svcs (UK) Lmtd.     - 💰 $17 – $19/h  - [Seasonal Non-Licensed Health Insurance Rep (Remote)](https://omnijobs.io/en/jobs/4597109?utm_source=reddit&amp;utm_medium=post&amp;utm_campaign=sep-4-cs) @ Concentrix Services Philippines, Inc.     - 💰 $15 – $16/h  - [Remote Customer Service Rep Call Center $15.00 Loyalty](https://omnijobs.io/en/jobs/4621896?utm_source=reddit&amp;utm_medium=post&amp;utm_campaign=sep-4-cs) @ Global Payments Asia-Pacific India Private Limited     - 💰 ~$15/h  - [Customer Support Associate](https://omnijobs.io/en/jobs/4629316?utm_source=reddit&amp;utm_medium=post&amp;utm_campaign=sep-4-cs) @ Cengage Learning Inc.     - 💰 $15 – $17/h  - [Client Support Associate](https://omnijobs.io/en/jobs/4591731?utm_source=reddit&amp;utm_medium=post&amp;utm_campaign=sep-4-cs) @ Veriforce LLC  - [Contact Center Rep- Mt. Laurel NJ, October 27th](https://omnijobs.io/en/jobs/4587675?utm_source=reddit&amp;utm_medium=post&amp;utm_campaign=sep-4-cs) @ TD Bank, N.A.     - 💰 $22 – $31/h  - [Customer Support 1](https://omnijobs.io/en/jobs/4588805?utm_source=reddit&amp;utm_medium=post&amp;utm_campaign=sep-4-cs) @ Marchon     - 💰 ~$15/h  - [Inbound Contacts Representative](https://omnijobs.io/en/jobs/4591532?utm_source=reddit&amp;utm_medium=post&amp;utm_campaign=sep-4-cs) @ Humana  - [Customer Service Representative Associate](https://omnijobs.io/en/jobs/4595385?utm_source=reddit&amp;utm_medium=post&amp;utm_campaign=sep-4-cs) @ Corewell Health Corporate  - [Member Services Representative](https://omnijobs.io/en/jobs/4599053?utm_source=reddit&amp;utm_medium=post&amp;utm_campaign=sep-4-cs) @ Connexus Credit Union  - [Customer Support Specialist (Part-Time)](https://omnijobs.io/en/jobs/4606382?utm_source=reddit&amp;utm_medium=post&amp;utm_campaign=sep-4-cs) @ Tovala  - [Customer Service Representative](https://omnijobs.io/en/jobs/4609220?utm_source=reddit&amp;utm_medium=post&amp;utm_campaign=sep-4-cs) @ Highmark Health  - [Customer Support Associate](https://omnijobs.io/en/jobs/4582370?utm_source=reddit&amp;utm_medium=post&amp;utm_campaign=sep-4-cs) @ CreativeX     - 💰 $45–50K/y  - [One-Year Outreach and Membership Services Assistant](https://omnijobs.io/en/jobs/4569651?utm_source=reddit&amp;utm_medium=post&amp;utm_campaign=sep-4-cs) @ Earthjustice  - [Call Center Agent](https://omnijobs.io/en/jobs/4577422?utm_source=reddit&amp;utm_medium=post&amp;utm_campaign=sep-4-cs) @ IQVIA Analytics Services Private Limited (IN03)     - 💰 $20 – $25/h  - [Customer Service Representative - Express Scripts - Remote](https://omnijobs.io/en/jobs/4578505?utm_source=reddit&amp;utm_medium=post&amp;utm_campaign=sep-4-cs) @ Cigna-Evernorth Services Inc.  - [Customer Contact Center Representative (10.28 LCM)](https://omnijobs.io/en/jobs/4584907?utm_source=reddit&amp;utm_medium=post&amp;utm_campaign=sep-4-cs) @ ALA Voya Retirement Insurance and Annuity Company     - 💰 ~$42K/y  - [Client Care Service Rep - Remote - MT](https://omnijobs.io/en/jobs/4588570?utm_source=reddit&amp;utm_medium=post&amp;utm_campaign=sep-4-cs) @ Northwestern Mutual     - 💰 $18 – $27/h  - [Bilingual Customer Service Representative](https://omnijobs.io/en/jobs/4590381?utm_source=reddit&amp;utm_medium=post&amp;utm_campaign=sep-4-cs) @ ReSource Pro     - 💰 $13 – $18/h  - [Seasonal Customer Service Representative - 2025 Texas](https://omnijobs.io/en/jobs/4594349?utm_source=reddit&amp;utm_medium=post&amp;utm_campaign=sep-4-cs) @ Minted  - [Account Advisor I - Provider Services (Remote-LA/Hybrid Training)](https://omnijobs.io/en/jobs/4603415?utm_source=reddit&amp;utm_medium=post&amp;utm_campaign=sep-4-cs) @ Louisiana Health Service &amp; Indemnity Company  - [Tucson PT Service Agent I- September](https://omnijobs.io/en/jobs/4645719?utm_source=reddit&amp;utm_medium=post&amp;utm_campaign=sep-4-cs) @ American National Red Cross     - 💰 ~$16/h  - [Customer Care Specialist I](https://omnijobs.io/en/jobs/4563568?utm_source=reddit&amp;utm_medium=post&amp;utm_campaign=sep-4-cs) @ AppFolio     - 💰 ~$24/h  - [Customer Service Representatives- Remote](https://omnijobs.io/en/jobs/4631827?utm_source=reddit&amp;utm_medium=post&amp;utm_campaign=sep-4-cs) @ Sutherland  - [Customer Care Representative](https://omnijobs.io/en/jobs/4577936?utm_source=reddit&amp;utm_medium=post&amp;utm_campaign=sep-4-cs) @ Hartford Fire Ins. Co  - [Technical Support Representative - You must live in Texas **Work from Home**](https://omnijobs.io/en/jobs/4595856?utm_source=reddit&amp;utm_medium=post&amp;utm_campaign=sep-4-cs) @ TaskUs Colombia SAS  - [Entry-Level Customer Support Representative (Remote)](https://omnijobs.io/en/jobs/4601170?utm_source=reddit&amp;utm_medium=post&amp;utm_campaign=sep-4-cs) @ AO SOUTH - Lisa Cassidy  Leave a like if I should do new one next week :)",3,4,1756929821,https://www.reddit.com/r/forhire/comments/1n7pcgy/hiring_40_remote_customer_support_jobs_entry_mid/
1n7u131,forhire,"[HIRING] Short-Form Video Editor (Remote, Part-Time or Full-Time)","Hey everyone,  Rizzo Media is looking for a Short-Form Video Editor to help us create engaging content for Instagram Reels, TikTok, and YouTube Shorts. If you’re creative, trend-savvy, and love editing videos that grab attention, this might be a great fit for you.  About Us: We’re a creative outsourcing company that helps businesses grow with content that captures attention and tells stories.  Role Overview: You’ll be editing short-form videos (15–60 seconds), keeping up with trending sounds/styles, and collaborating with our team to bring scripts and ideas to life.  Responsibilities:  ✅️Edit and produce high-quality short-form videos  ✅️Stay on top of trending formats, sounds, and visual styles  ✅️Work with the team to bring ideas to life  ✅️Deliver polished, on-brand content on time   Requirements:  ✅️Experience in short-form video editing  ✅️Knowledge of social media trends  ✅️Creative problem-solver with attention to detail  ✅️Good communication and ability to hit deadlines    Work Setup &amp; Perks:  ✅️100% Remote  ✅️Flexible hours (part-time or full-time)  ✅️Opportunity to grow with a creative team   💲Rate: $15/video  How to Apply: Please fill out this quick form: 👉 https://forms.gle/UbGiR9W6KnEPRMvr7",2,7,1756941027,https://www.reddit.com/r/forhire/comments/1n7u131/hiring_shortform_video_editor_remote_parttime_or/
1n7qlll,forhire,[For Hire] N8N automations,"I am freelancing and can automate workflows via N8N.   Current workflows include  -X reply machine (scrapes x accounts and suggests replies curated according to you/replies directly on X)  - LinkedIn job scraper (you input category and other filters, it reaches out to the recruiter/hr in a way that your account doesn’t get flagged)  -Any Query (it can specialise on your queries via rag, or generalise for you via web)   Will be following up and maintaining the workflow according to your needs, provide you space in my n8n and an execution limit.  Prices are flexible. Starting $100(workflow only) depending-on the complexity, size and executions/ month(please reach out via dms to discuss an accurate one)",3,1,1756932649,https://www.reddit.com/r/forhire/comments/1n7qlll/for_hire_n8n_automations/
1n7sxf7,forhire,"[Hiring] Commission Sales Rep – Flexible Hours, Automotive Tools ($4K–$8K/mo OTE)","We’re looking for independent sales reps to demo and sell a **revolutionary automotive tool** to auto and truck service stations. Perfect for someone who wants **flexible income** — part-time or full-time.  **Details:**  * Commission only (15% net profit per sale)   * Average reps earn $4K–$8K/month; top performers $10K+   * Recurring sales = monthly residual income   * Must have at least 1 year of sales experience (B2B preferred)   * Automotive/manufacturing background a plus   * Requires purchase of an affordable demo kit (reduced cost) to show product in action    If you’re motivated, reliable, and want to build extra income (or grow into a full-time hustle), send your resume to **jobs@studandhubpros.com**[**jobs@studandhubpros.com**]().  [**jobs@studandhubpros.com**]()[**jobs@studandhubpros.com**]()jobs@studandhubpros.com.",2,11,1756938234,https://www.reddit.com/r/forhire/comments/1n7sxf7/hiring_commission_sales_rep_flexible_hours/
1n7mhhw,forhire,🚀 We’re Hiring: Outreach Specialist  [Hiring]🚀,"I’m looking for a driven Outreach Expert to join our team! Your role will be to find leads, reach out, pitch our services, and ideally book meetings. You’ll be fully responsible for managing and executing the outreach pipeline.  💼 What we’re looking for:  •Someone who’s confident in researching and identifying potential clients.  •Strong communication and pitching skills.  •Proactive mindset with the ability to take full ownership of outreach.  💰 Compensation:  •First month: Commission-based (performance-driven).  •From second month onward: Fixed salary (15$ / hour) + commissions.  🌍 Why join us? You’ll get the chance to work closely with a fast-growing agency, have direct impact on client acquisition, and grow with us long-term.  If you’re hungry to prove yourself, love closing deals, and want to grow in the world of outreach &amp; lead generation, this is for you!  👉 Drop me a DM, and let’s talk!",3,2,1756923382,https://www.reddit.com/r/forhire/comments/1n7mhhw/were_hiring_outreach_specialist_hiring/
1n7own8,forhire,[for hire] Logo designer at your service $15/hr,"Need a custom logo, illustration and advertisement for your social media or business? I've got you covered with affordable prices adjusted to your budget. I have extensive experience in designing logos that are both aesthetically pleasing and effectively convey the message you want to send. I would be honored to help bring your vision to life. Works are mainly done in Illustrator.   Payment method : Paypal   Works: https://www.behance.net/gallery/155112467/Logo-Mockups   https://www.behance.net/gallery/226829045/Moodboards-and-more  Email : heraldic.team@gmail.com",2,1,1756928817,https://www.reddit.com/r/forhire/comments/1n7own8/for_hire_logo_designer_at_your_service_15hr/
1n7bsm8,forhire,[Hiring] Looking for a C++ developer for a paid project.,"Hi everyone, I’m looking for someone experienced in C++ programming to help me with a project. Here are the details:  Type of work: 3D computer graphics assignment  Requirements: Please explain to me the code that was used.  Deadline: 2 months  Budget: $200-300  I will provide more detailed requirements once we connect. Payment will be made via PayPal (or another secure method we both agree on). If you’re interested, please DM me with: A short intro about your experience Relevant examples of past work/projects Your estimated timeline and cost  Thank you in advance!",9,16,1756897529,https://www.reddit.com/r/forhire/comments/1n7bsm8/hiring_looking_for_a_c_developer_for_a_paid/
1n7e04p,forhire,[Hiring] Cold Reachout w/ Good Written English Skills,"Hi folks,     We're looking to hire somebody to conduct cold reachouts via DM. We have all of the lists you'll need, and we'll provide the message to send. The bulk of this work will be DMing and replying to people, so you need strong written English skills.  We're happy to pay either around $15/hour - or, ideally, we'll pay you per message sent at a reasonable rate. The faster these messages are sent, the higher the hourly rate. These are relatively small projects, and shouldn't take to long. The list isn't endless, but it's likely that we'll need recurring work.  If you're interested, please DM me on Discord at aidanmcg\_ with a quick intro, why you think you'd be a good fit, and your rate.  Thanks very much!",6,7,1756904022,https://www.reddit.com/r/forhire/comments/1n7e04p/hiring_cold_reachout_w_good_written_english_skills/
1n7rxv6,forhire,[hiring] bets tester - 200 dollars,"Hey folks, I’m helping test a new AI image bot as part of a closed beta challenge. The idea is simple: generate fun filters (like logo swaps, meme overlays, quick edits) and have them tested by real users in live chats.  We’re looking for early testers who can play around with it, share feedback, or even try building a filter themselves if they’re curious. It’s lightweight, not a big time commitment, and any input helps us improve before launch.  If you’re interested, here’s the application link: [https://linkly.link/2EaSL](https://linkly.link/2EaSL)",0,4,1756935823,https://www.reddit.com/r/forhire/comments/1n7rxv6/hiring_bets_tester_200_dollars/
